{
  "$schema": "http://json-schema.org/draft-07/schema#",
  "$id": "https://github.com/mochimochiki/mdait/schemas/mdait-config.schema.json",
  "title": "mdait Configuration",
  "description": "Configuration file for mdait (Markdown AI Translator)",
  "type": "object",
  "properties": {
    "$schema": {
      "type": "string",
      "description": "JSON Schema reference for IDE support"
    },
    "transPairs": {
      "type": "array",
      "description": "Translation pairs configuration. Define source and target directories for translation.",
      "items": {
        "type": "object",
        "required": ["sourceLang", "sourceDir", "targetLang", "targetDir"],
        "properties": {
          "sourceLang": {
            "type": "string",
            "description": "Source language code (e.g., 'ja', 'en')",
            "pattern": "^[a-z]{2}(-[A-Z]{2})?$",
            "examples": ["ja", "en", "de", "fr", "zh-CN"]
          },
          "sourceDir": {
            "type": "string",
            "description": "Path to the directory containing source language documents (relative to workspace root)",
            "examples": ["docs/ja", "content/en"]
          },
          "targetLang": {
            "type": "string",
            "description": "Target language code (e.g., 'en', 'ja')",
            "pattern": "^[a-z]{2}(-[A-Z]{2})?$",
            "examples": ["ja", "en", "de", "fr", "zh-CN"]
          },
          "targetDir": {
            "type": "string",
            "description": "Path to the directory to store target language documents (relative to workspace root)",
            "examples": ["docs/en", "content/ja"]
          }
        },
        "additionalProperties": false
      },
      "minItems": 1
    },
    "ignoredPatterns": {
      "oneOf": [
        {
          "type": "string",
          "description": "Glob pattern for files and directories to exclude from translation and sync processing"
        },
        {
          "type": "array",
          "description": "List of glob patterns for files and directories to exclude",
          "items": {
            "type": "string"
          }
        }
      ],
      "default": "**/node_modules/**",
      "examples": ["**/node_modules/**", ["**/node_modules/**", "**/.git/**", "**/dist/**"]]
    },
    "sync": {
      "type": "object",
      "description": "Synchronization settings",
      "properties": {
        "level": {
          "type": "integer",
          "description": "Heading level at which to automatically insert mdait markers (1-6, or 0 to disable). Can be overridden in frontmatter.",
          "minimum": 0,
          "maximum": 6,
          "default": 2
        },
        "autoDelete": {
          "type": "boolean",
          "description": "Automatically delete units on target side when deleted on source side during sync",
          "default": true
        },
        "autoSyncOnSave": {
          "type": "boolean",
          "description": "Automatically sync files when saved (only files with mdait markers)",
          "default": true
        }
      },
      "additionalProperties": false
    },
    "ai": {
      "type": "object",
      "description": "AI provider configuration for translation and term processing",
      "properties": {
        "provider": {
          "type": "string",
          "description": "AI provider to use for translation",
          "enum": ["default", "vscode-lm", "ollama", "openai"],
          "default": "vscode-lm"
        },
        "model": {
          "type": "string",
          "description": "AI model name to use with the selected provider",
          "default": "gpt-4.1",
          "examples": ["gpt-4.1", "gpt-5 mini"]
        },
        "ollama": {
          "type": "object",
          "description": "Ollama-specific settings (when provider is 'ollama')",
          "properties": {
            "endpoint": {
              "type": "string",
              "description": "Ollama server endpoint URL",
              "format": "uri",
              "default": "http://localhost:11434",
              "examples": ["http://localhost:11434", "http://ollama-server:11434"]
            },
            "model": {
              "type": "string",
              "description": "Ollama model name to use",
              "default": "llama2",
              "examples": ["llama2", "llama3", "mistral", "codellama"]
            }
          },
          "additionalProperties": false
        },
        "openai": {
          "type": "object",
          "description": "OpenAI-specific settings (when provider is 'openai')",
          "properties": {
            "apiKey": {
              "type": "string",
              "description": "OpenAI API key. Can use ${env:VARIABLE_NAME} syntax to reference environment variables.",
              "examples": ["${env:OPENAI_API_KEY}", "sk-..."]
            },
            "baseURL": {
              "type": "string",
              "description": "OpenAI API base URL (optional, defaults to https://api.openai.com/v1)",
              "format": "uri",
              "default": "https://api.openai.com/v1",
              "examples": ["https://api.openai.com/v1", "https://your-proxy.com/v1"]
            },
            "maxTokens": {
              "type": "integer",
              "description": "Maximum number of tokens to generate in the response.",
              "minimum": 1,
              "default": 16384
            },
            "timeoutSec": {
              "type": "integer",
              "description": "Request timeout in seconds.",
              "minimum": 1,
              "default": 120
            }
          },
          "additionalProperties": false
        },
        "debug": {
          "type": "object",
          "description": "Debug settings for AI communication",
          "properties": {
            "enableStatsLogging": {
              "type": "boolean",
              "description": "Enable AI communication statistics logging to .mdait/logs/ai-stats.log for debugging purposes",
              "default": true
            },
            "logPromptAndResponse": {
              "type": "boolean",
              "description": "Enable detailed AI logging including prompts and responses to .mdait/logs/ai-detailed.log (warning: may contain sensitive data)",
              "default": false
            }
          },
          "additionalProperties": false
        }
      },
      "additionalProperties": false
    },
    "trans": {
      "type": "object",
      "description": "Translation settings",
      "properties": {
        "markdown": {
          "type": "object",
          "description": "Markdown-specific translation settings",
          "properties": {
            "skipCodeBlocks": {
              "type": "boolean",
              "description": "Whether to exclude code blocks from translation targets when translating markdown",
              "default": true
            }
          },
          "additionalProperties": false
        },
        "frontmatter": {
          "type": "object",
          "description": "Frontmatter translation settings",
          "properties": {
            "keys": {
              "type": "array",
              "description": "Frontmatter keys to translate. Empty array disables frontmatter translation.",
              "items": {
                "type": "string"
              },
              "default": ["title", "description"]
            }
          },
          "additionalProperties": false
        },
        "contextSize": {
          "type": "integer",
          "description": "Number of surrounding units (before and after) to include as context for AI translation. Higher values provide more context but increase token usage. Set to 0 to disable context.",
          "minimum": 0,
          "maximum": 5,
          "default": 1,
          "examples": [0, 1, 2, 3]
        },
        "retryLimit": {
          "type": "integer",
          "description": "Maximum number of retries for translation failures. Limited to 1-5; values below 1 are raised to 1, and values 6+ are capped at 5.",
          "minimum": 1,
          "maximum": 5,
          "default": 1,
          "examples": [1, 2, 3, 5]
        }
      },
      "additionalProperties": false
    },
    "terms": {
      "type": "object",
      "description": "Glossary/terminology settings",
      "properties": {
        "filename": {
          "type": "string",
          "description": "Glossary filename (supports .csv and .yaml formats)",
          "default": "terms.csv",
          "pattern": "^[^/\\\\]+\\.(csv|ya?ml)$",
          "examples": ["terms.csv", "glossary.yaml", "terminology.yml"]
        },
        "primaryLang": {
          "type": "string",
          "description": "Primary language code for glossary management",
          "pattern": "^[a-z]{2}(-[A-Z]{2})?$",
          "examples": ["en", "ja", "de"]
        }
      },
      "additionalProperties": false
    },
    "tm": {
      "type": "object",
      "description": "Translation Memory (TM) settings",
      "properties": {
        "enabled": {
          "type": "boolean",
          "description": "Enable or disable the TM feature. When disabled, both tm-commit and trans TM references are deactivated.",
          "default": true
        },
        "maxReferences": {
          "type": "integer",
          "description": "Maximum number of TM references to include in translation prompts. Higher values provide more context but increase token usage.",
          "minimum": 1,
          "maximum": 20,
          "default": 5
        }
      },
      "additionalProperties": false
    },
    "prompts": {
      "type": "object",
      "description": "Custom prompt overrides. Specify file paths (relative to workspace root) for each prompt ID.",
      "properties": {
        "trans.translate": {
          "type": "string",
          "description": "Path to custom Markdown translation prompt file",
          "examples": [".mdait/prompts/translate.txt"]
        },
        "trans.revisePatch": {
          "type": "string",
          "description": "Path to custom revision patch translation prompt file",
          "examples": [".mdait/prompts/revise-patch.txt"]
        },
        "term.detect": {
          "type": "string",
          "description": "Path to custom term detection prompt file",
          "examples": [".mdait/prompts/term-detect.txt"]
        },
        "term.extractFromTranslations": {
          "type": "string",
          "description": "Path to custom term extraction from translations prompt file",
          "examples": [".mdait/prompts/term-extract.txt"]
        },
        "term.translateTerms": {
          "type": "string",
          "description": "Path to custom term translation prompt file",
          "examples": [".mdait/prompts/term-translate.txt"]
        },
        "tm.splitSentences": {
          "type": "string",
          "description": "Path to custom TM sentence alignment prompt file",
          "examples": [".mdait/prompts/tm-split-sentences.txt"]
        }
      },
      "additionalProperties": false
    }
  },
  "required": ["transPairs"],
  "additionalProperties": false
}
